{
  "$schema": "https://json-schema.org/draft/2020-12/schema",
  "type": "object",
  "required": ["actor_role", "from_status", "to_status", "ts"],
  "properties": {
    "pr_id": { "type": "string" },
    "actor_role": { "type": "string" },
    "actor_id": { "type": "string" },
    "from_status": { "type": "string" },
    "to_status": { "type": "string" },
    "ts": { "type": "string" },
    "comment": { "type": "string" }
  }
}
