[
  {
    "actor_role": "dev",
    "from_status": "draft",
    "to_status": "open",
    "ts": "2023-10-01T10:00:00Z"
  },
  {
    "actor_role": "reviewer",
    "from_status": "open",
    "to_status": "in_review",
    "ts": "2023-10-02T14:00:00Z"
  },
  {
    "actor_role": "reviewer",
    "from_status": "in_review",
    "to_status": "changes_requested",
    "ts": "2023-10-03T09:30:00Z"
  },
  {
    "actor_role": "maintainer",
    "from_status": "changes_requested",
    "to_status": "approved",
    "ts": "2023-10-04T11:45:00Z"
  },
  {
    "actor_role": "maintainer",
    "from_status": "approved",
    "to_status": "merged",
    "ts": "2023-10-05T16:50:00Z"
  }
]