[{"actor_role": "impl_engineer", "from_status": "changes_requested", "to_status": "in_review", "ts": "2023-10-08T12:00:00Z"}, {"actor_role": "reviewer","from_status": "in_review","to_status": "approved","ts": "2023-10-09T08:00:00Z"}, {"actor_role": "maintainer","from_status": "approved","to_status": "merged","ts": "2023-10-09T09:00:00Z"}]